{
  "schema_version": 2,
  "run_id": "a3d36e24a80247d198d1869c0de186ff",
  "tool_version": "1.3.2",
  "suite_schema_version": 2,
  "suite": "QA Sentinel Demo Regression Suite",
  "description": "",
  "environment": "local demo",
  "environment_config_hash": null,
  "suite_config_hash": "26a3084e012e0ae7",
  "provenance": {
    "git_sha": null,
    "git_branch": null,
    "ci_url": null
  },
  "execution": {
    "workers": 4,
    "selected_tags": [],
    "retry": {
      "max_retries": 1,
      "retry_on_status": [
        429,
        500,
        502,
        503,
        504
      ],
      "retry_non_idempotent": false
    }
  },
  "secret_sources": [],
  "started_at": "2026-09-09T13:52:08.044+00:00",
  "finished_at": "2026-09-09T13:52:08.140+00:00",
  "duration_ms": 96.022,
  "slow_threshold_ms": 500.0,
  "interrupted": false,
  "summary": {
    "total": 5,
    "passed": 5,
    "failed": 0,
    "errors": 0,
    "blocked": 0,
    "skipped": 0,
    "success_rate": 100.0
  },
  "capture_metadata": [],
  "tests": [
    {
      "id": "health-check",
      "request_id": "health-check",
      "name": "Service health and version contract",
      "method": "GET",
      "url": "http://127.0.0.1:8765/health?token=[REDACTED]",
      "tags": [
        "smoke",
        "contract"
      ],
      "passed": true,
      "status": "passed",
      "response_status": 200,
      "response_size_bytes": 59,
      "response_content_type": "application/json",
      "latency_ms": 31.362,
      "attempts": 1,
      "error": null,
      "response_preview": null,
      "started_at": "2026-09-09T13:52:08.044+00:00",
      "finished_at": "2026-09-09T13:52:08.076+00:00",
      "assertions": [
        {
          "path": "tests[0].assertions[0]",
          "type": "status",
          "passed": true,
          "message": "status 200 matched 200",
          "expected": 200,
          "actual": 200
        },
        {
          "path": "tests[0].assertions[1]",
          "type": "json_path",
          "passed": true,
          "message": "path 'status' matched expected value",
          "expected": "ok",
          "actual": "ok"
        },
        {
          "path": "tests[0].assertions[2]",
          "type": "json_path",
          "passed": true,
          "message": "path 'version' matched expected value",
          "expected": "1.0.0",
          "actual": "1.0.0"
        },
        {
          "path": "tests[0].assertions[3]",
          "type": "header",
          "passed": true,
          "message": "header 'X-Demo-API' matched",
          "expected": "qa-sentinel",
          "actual": "qa-sentinel"
        },
        {
          "path": "tests[0].assertions[4]",
          "type": "latency",
          "passed": true,
          "message": "latency 31.4 ms was within 500 ms",
          "expected": 500.0,
          "actual": 31.362
        }
      ]
    },
    {
      "id": "user-contract",
      "request_id": "user-contract",
      "name": "Nested user response contract",
      "method": "GET",
      "url": "http://127.0.0.1:8765/users/1",
      "tags": [
        "regression",
        "json"
      ],
      "passed": true,
      "status": "passed",
      "response_status": 200,
      "response_size_bytes": 75,
      "response_content_type": "application/json",
      "latency_ms": 34.631,
      "attempts": 1,
      "error": null,
      "response_preview": null,
      "started_at": "2026-09-09T13:52:08.044+00:00",
      "finished_at": "2026-09-09T13:52:08.079+00:00",
      "assertions": [
        {
          "path": "tests[1].assertions[0]",
          "type": "status",
          "passed": true,
          "message": "status 200 matched 200",
          "expected": 200,
          "actual": 200
        },
        {
          "path": "tests[1].assertions[1]",
          "type": "json_path",
          "passed": true,
          "message": "path 'data.id' matched expected value",
          "expected": 1,
          "actual": 1
        },
        {
          "path": "tests[1].assertions[2]",
          "type": "json_path",
          "passed": true,
          "message": "path 'data.roles[1]' matched expected value",
          "expected": "engineer",
          "actual": "engineer"
        },
        {
          "path": "tests[1].assertions[3]",
          "type": "json_path",
          "passed": true,
          "message": "path 'data.email' was absent as expected",
          "expected": false,
          "actual": false
        }
      ]
    },
    {
      "id": "create-payload",
      "request_id": "create-payload",
      "name": "POST body serialization and echo",
      "method": "POST",
      "url": "http://127.0.0.1:8765/echo",
      "tags": [
        "regression",
        "write"
      ],
      "passed": true,
      "status": "passed",
      "response_status": 201,
      "response_size_bytes": 64,
      "response_content_type": "application/json",
      "latency_ms": 34.366,
      "attempts": 1,
      "error": null,
      "response_preview": null,
      "started_at": "2026-09-09T13:52:08.045+00:00",
      "finished_at": "2026-09-09T13:52:08.079+00:00",
      "assertions": [
        {
          "path": "tests[2].assertions[0]",
          "type": "status",
          "passed": true,
          "message": "status 201 matched 201",
          "expected": 201,
          "actual": 201
        },
        {
          "path": "tests[2].assertions[1]",
          "type": "json_path",
          "passed": true,
          "message": "path 'received.name' matched expected value",
          "expected": "sentinel",
          "actual": "sentinel"
        },
        {
          "path": "tests[2].assertions[2]",
          "type": "json_path",
          "passed": true,
          "message": "path 'received.enabled' matched expected value",
          "expected": true,
          "actual": true
        }
      ]
    },
    {
      "id": "retry-recovery",
      "request_id": "retry-recovery",
      "name": "Transient failure recovers after retry",
      "method": "GET",
      "url": "http://127.0.0.1:8765/unstable?key=quickstart&failures=1",
      "tags": [
        "resilience",
        "retry"
      ],
      "passed": true,
      "status": "passed",
      "response_status": 200,
      "response_size_bytes": 37,
      "response_content_type": "application/json",
      "latency_ms": 4.354,
      "attempts": 2,
      "error": null,
      "response_preview": null,
      "started_at": "2026-09-09T13:52:08.045+00:00",
      "finished_at": "2026-09-09T13:52:08.140+00:00",
      "assertions": [
        {
          "path": "tests[3].assertions[0]",
          "type": "status",
          "passed": true,
          "message": "status 200 matched 200",
          "expected": 200,
          "actual": 200
        },
        {
          "path": "tests[3].assertions[1]",
          "type": "json_path",
          "passed": true,
          "message": "path 'status' matched expected value",
          "expected": "recovered",
          "actual": "recovered"
        },
        {
          "path": "tests[3].assertions[2]",
          "type": "json_path",
          "passed": true,
          "message": "path 'attempt' matched expected value",
          "expected": 2,
          "actual": 2
        }
      ]
    },
    {
      "id": "latency-budget",
      "request_id": "latency-budget",
      "name": "Endpoint stays within latency budget",
      "method": "GET",
      "url": "http://127.0.0.1:8765/slow?ms=30",
      "tags": [
        "performance"
      ],
      "passed": true,
      "status": "passed",
      "response_status": 200,
      "response_size_bytes": 17,
      "response_content_type": "application/json",
      "latency_ms": 51.651,
      "attempts": 1,
      "error": null,
      "response_preview": null,
      "started_at": "2026-09-09T13:52:08.076+00:00",
      "finished_at": "2026-09-09T13:52:08.128+00:00",
      "assertions": [
        {
          "path": "tests[4].assertions[0]",
          "type": "status",
          "passed": true,
          "message": "status 200 matched 200",
          "expected": 200,
          "actual": 200
        },
        {
          "path": "tests[4].assertions[1]",
          "type": "json_path",
          "passed": true,
          "message": "path 'waited_ms' matched expected value",
          "expected": 30,
          "actual": 30
        },
        {
          "path": "tests[4].assertions[2]",
          "type": "latency",
          "passed": true,
          "message": "latency 51.7 ms was within 500 ms",
          "expected": 500.0,
          "actual": 51.651
        }
      ]
    }
  ]
}
